{"$schema":"https://json-schema.org/draft/2020-12/schema","type":"object","additionalProperties":false,"required":["ruleVersion","runtimeSource","stateThresholds","hysteresisDegrees","minimumStableFrames","minimumRepDurationMs","maximumRepDurationMs","visibilityThreshold","landmarkLossTimeoutMs","feedbackCooldownMs","supportedCameraOrientation","calibrationDate","notes"],"properties":{"ruleVersion":{"type":"string"},"runtimeSource":{"type":"string"},"stateThresholds":{"type":"object","additionalProperties":{"type":"number"}},"hysteresisDegrees":{"type":"object","additionalProperties":{"type":"number","minimum":0}},"minimumStableFrames":{"type":"integer","minimum":1},"minimumRepDurationMs":{"type":"integer","minimum":0},"maximumRepDurationMs":{"type":"integer","minimum":1},"visibilityThreshold":{"type":"number","minimum":0,"maximum":1},"landmarkLossTimeoutMs":{"type":"integer","minimum":0},"feedbackCooldownMs":{"type":"integer","minimum":0},"supportedCameraOrientation":{"type":"array","items":{"type":"string"}},"calibrationDate":{"type":["string","null"]},"notes":{"type":"string"}}}
