{"ruleVersion":"1.0.0","runtimeSource":"packages/exercise_engine/lib/src/config/exercise_engine_config.dart","stateThresholds":{"extendedAngle":155,"flexingAngle":145,"contractedAngle":55,"extendingAngle":65,"upperArmDisplacementTolerance":0.25},"hysteresisDegrees":{"extendedFlexing":10,"contractedExtending":10},"minimumStableFrames":3,"minimumRepDurationMs":500,"maximumRepDurationMs":10000,"visibilityThreshold":0.60,"landmarkLossTimeoutMs":750,"feedbackCooldownMs":1500,"supportedCameraOrientation":["left_side","right_side"],"calibrationDate":null,"notes":"Phase 5 runtime defaults snapshot; no Phase 9 threshold change without consented calibration evidence."}
