{"ruleVersion":"1.0.0","runtimeSource":"packages/exercise_engine/lib/src/config/exercise_engine_config.dart","stateThresholds":{"standingAngle":160,"descendingAngle":155,"bottomAngle":100,"ascendingAngle":105},"hysteresisDegrees":{"standingDescending":5,"bottomAscending":5},"minimumStableFrames":3,"minimumRepDurationMs":500,"maximumRepDurationMs":10000,"visibilityThreshold":0.60,"landmarkLossTimeoutMs":750,"feedbackCooldownMs":1500,"supportedCameraOrientation":["front","left_side","right_side"],"calibrationDate":null,"notes":"Phase 5 runtime defaults snapshot; no Phase 9 threshold change without consented calibration evidence."}
